{
  "recovery_mode": "active",
  "cci_formula": "average_ingredients_cci + 0.4 * sqrt(max(0, ingredients_count - 1)) + stages_weight",
  "cci_min": 1.0,
  "cci_max": 4.0,
  "monotony_increase": "base_increase * 5 * (0.85 + 0.30 * (hunger + saturation) / (hunger + saturation + 10)) / (125 / 9 - 3 * (min(4, max(1, cci)) - 1))",
  "catalyst_formula": "1 + 0.25 * (min(4, max(1, cci)) - min(4, max(1, cci_b)))",
  "debuff_factor": "(0.125 + 0.0056 * monotony_b^2) / ((1 - (min(4, max(1, cci)) - 1) / 3) / 0.94 + ((min(4, max(1, cci)) - 1) / 3) / 2.4)",
  "recovery_formula": "max(0, monotony_b - base_recovery * catalyst_a * debuff_factor * (1 + recovery_acceleration * max(0, recovery_meals - recovery_delay)))",
  "nutrient_add": "base_n * stage_multiplier",
  "offset_cat": 1.0,
  "d_cci": 1.5,
  "base_scale": 10.0,
  "d_monotony": 0.02,
  "base_recovery": 1.0,
  "k_norm": 10.0,
  "base_increase": 1.0,
  "monotony_cap": 24.0,
  "recovery_delay": 20,
  "recovery_acceleration": 0.08,
  "recovery_requires_hunger": true,
  "recovery_reset_on_eat": true,
  "recovery_min_hunger_restored": 1
}
